{
  "audit_id": "kstrk_nethermind_unknown",
  "project": "kSTRK",
  "auditor": "Nethermind",
  "date": "2024-12-15",
  "source_url": "https://github.com/NethermindEth/PublicAuditReports/blob/main/NM0392_FINAL_ZKLEND_STRK_LIQUID_STAKING.pdf",
  "repository": "https://github.com/zkLend",
  "scope_files": [
    "src/staked_token.cairo",
    "src/interfaces.cairo",
    "src/pool.cairo",
    "src/staker.cairo",
    "src/lib.cairo",
    "src/proxy.cairo",
    "src/staked_token/staked_token.cairo",
    "src/staked_token/interface.cairo",
    "src/proxy/interface.cairo",
    "src/proxy/proxy.cairo",
    "src/staker/staker.cairo",
    "src/staker/interface.cairo",
    "src/pool/pool.cairo",
    "src/pool/interface.cairo"
  ],
  "finding_count": 0,
  "finding_label_semantics": "report_declared_zero_findings",
  "negative_label_scope": "audit_scope_only",
  "safety_claim": "not_proven",
  "severity_counts": {},
  "status_summary": {},
  "notes": "The report explicitly states that no issues were found in the reviewed scope. This is audit-level zero-finding evidence, not proof that every file or function is safe; code units remain unlabeled for vulnerability training."
}
