{
  "audit_id": "endur_withdrawal_queue_upgrade_cairo_security_clan_2025",
  "project": "Endur Withdrawal Queue Upgrade",
  "auditor": "Cairo Security Clan",
  "date": "2025-01-23",
  "source_url": "https://drive.google.com/file/d/1IUySv0Z924vfRDMDNVupH9VR9WdoqKax/view",
  "repository": "https://github.com/endurfi",
  "scope_files": [
    "src/delegator/delegator.cairo",
    "src/delegator/interface.cairo",
    "src/lst/lst.cairo",
    "src/timelock/timelock.cairo",
    "src/withdrawal_queue/interface.cairo",
    "src/withdrawal_queue/withdrawal_queue.cairo"
  ],
  "finding_count": 1,
  "finding_label_semantics": "reported_findings_present",
  "negative_label_scope": "none",
  "safety_claim": "not_proven",
  "severity_counts": {
    "info": 1
  },
  "status_summary": {
    "acknowledged": 1
  },
  "notes": "Structured coverage pass with report-declared finding-count verification; not human-adjudicated gold data."
}
