{
  "audit_id": "endur_v1_launch_cairo_security_clan_2024",
  "project": "Endur V1 Launch",
  "auditor": "Cairo Security Clan",
  "date": "2024-11-22",
  "source_url": "https://drive.google.com/file/d/1EufZmcW9k5yq5Jivek1MjTCVnft5WRER/view",
  "repository": "https://github.com/endurfi",
  "scope_files": [
    "src/delegator/delegator.cairo",
    "src/delegator/interface.cairo",
    "src/interfaces/delegation_pool.cairo",
    "src/interfaces/staking.cairo",
    "src/lib.cairo",
    "src/lst/erc4626.cairo",
    "src/lst/interface.cairo",
    "src/lst/lst.cairo",
    "src/utils/common.cairo",
    "src/utils/constants.cairo",
    "src/utils/erc20helper.cairo",
    "src/utils/errors.cairo",
    "src/utils/math.cairo",
    "src/withdrawal_queue/interface.cairo",
    "src/withdrawal_queue/withdrawal_queue.cairo"
  ],
  "finding_count": 8,
  "finding_label_semantics": "reported_findings_present",
  "negative_label_scope": "none",
  "safety_claim": "not_proven",
  "severity_counts": {
    "best_practice": 1,
    "high": 2,
    "info": 1,
    "low": 3,
    "medium": 1
  },
  "status_summary": {
    "acknowledged": 2,
    "resolved": 6
  },
  "notes": "Structured coverage pass with report-declared finding-count verification; not human-adjudicated gold data."
}
