{
  "audit_id": "endur_btc_staking_multi_validator_cairo_security_clan_2025",
  "project": "Endur BTC Staking + Multi-Validator",
  "auditor": "Cairo Security Clan",
  "date": "2025-09-13",
  "source_url": "https://drive.google.com/file/d/1NDr0HnKFbnk0NVlk51BWlxPiVH-IXNhY/view",
  "repository": "https://github.com/endurfi",
  "scope_files": [
    "src/governor/governor.cairo",
    "src/governor/interface.cairo",
    "src/swap_extensions/swap_extension.cairo",
    "src/swap_extensions/swap_component.cairo",
    "src/swap_extensions/interface.cairo",
    "src/validator_registry/validator_registry.cairo",
    "src/validator_registry/interface.cairo",
    "src/lib.cairo",
    "src/delegator/interface.cairo",
    "src/delegator/delegator.cairo",
    "src/lst/interface.cairo",
    "src/lst/lst.cairo",
    "src/timelock/timelock.cairo",
    "src/utils/common.cairo",
    "src/utils/constants.cairo",
    "src/utils/errors.cairo",
    "src/withdrawal_queue/withdrawal_queue.cairo",
    "src/withdrawal_queue/interface.cairo",
    "validator_registry.cairo",
    "utils/constant.cairo",
    "/home/boreas/endurv2/src/lst/interface.cairo",
    "/home/boreas/endurv2/src/delegator/delegator.cairo",
    "/home/boreas/endurv2/src/timelock/timelock.cairo",
    "/home/teja9999/endur/lst/src/lst/interface.cairo",
    "/home/teja9999/endur/lst/src/lst/tests/test_integration.cairo",
    "/home/teja9999/endur/lst/src/lst/tests/test_lst_deposit.cairo",
    "/home/teja9999/endur/lst/src/lst/tests/test_lst_mint.cairo",
    "/home/teja9999/endur/lst/src/lst/tests/test_lst_utils.cairo",
    "/home/teja9999/endur/lst/src/withdrawal_queue/tests/test_withdrawal_queue.cairo",
    "/home/teja9999/endur/lst/src/delegator/delegator.cairo",
    "/home/teja9999/endur/lst/src/delegator/tests/test_delegator.cairo",
    "/home/teja9999/endur/lst/src/governor/tests/test_governor.cairo",
    "/home/teja9999/endur/lst/src/timelock/timelock.cairo",
    "/home/teja9999/endur/lst/src/validator_registry/tests/test_validator_registry.cairo",
    "/home/teja9999/endur/lst/src/validator_registry/tests/vr_system.cairo",
    "/home/teja9999/endur/lst/src/test_utils.cairo"
  ],
  "finding_count": 12,
  "finding_label_semantics": "reported_findings_present",
  "negative_label_scope": "none",
  "safety_claim": "not_proven",
  "severity_counts": {
    "best_practice": 1,
    "high": 1,
    "info": 2,
    "low": 4,
    "medium": 4
  },
  "status_summary": {
    "acknowledged": 1,
    "resolved": 11
  },
  "notes": "Structured coverage pass with report-declared finding-count verification; not human-adjudicated gold data."
}
